full_text,tokens,processed_text
guruguru jadi korban dari kurikulum obe yang berbelitbelit,"['guruguru', 'korban', 'kurikulum', 'obe', 'berbelitbelit']",guruguru korban kurikulum obe berbelitbelit
administrasi obe ini bikin guru capek mental,"['administrasi', 'obe', 'bikin', 'guru', 'capek', 'mental']",administrasi obe bikin guru capek mental
obe malah bikin anakanak stress karena terlalu banyak project,"['obe', 'bikin', 'anakanak', 'stress', 'project']",obe bikin anakanak stress project
kualitas obe bagus siswa jadi lebih mandiri dalam belajar,"['kualitas', 'obe', 'bagus', 'siswa', 'mandiri', 'ajar']",kualitas obe bagus siswa mandiri ajar
pemerintah asal nerapin obe tanpa liat kondisi sekolah di daerah,"['perintah', 'nerapin', 'obe', 'liat', 'kondisi', 'sekolah', 'daerah']",perintah nerapin obe liat kondisi sekolah daerah
ya gitu obe tidak ada yang spesialspesial amat,"['ya', 'gitu', 'obe', 'spesialspesial']",ya gitu obe spesialspesial
anakanak lebih suka belajar dengan metode obe yang interaktif,"['anakanak', 'suka', 'ajar', 'metode', 'obe', 'interaktif']",anakanak suka ajar metode obe interaktif
obe mah hanya program pencitraan pemerintah saja,"['obe', 'mah', 'program', 'citra', 'perintah']",obe mah program citra perintah
suka sekali sama konsep obe yang bikin anak lebih aktif,"['suka', 'konsep', 'obe', 'bikin', 'anak', 'aktif']",suka konsep obe bikin anak aktif
sekolah di pelosok mana bisa ngikutin standar obe yang tinggi,"['sekolah', 'pelosok', 'ngikutin', 'standar', 'obe']",sekolah pelosok ngikutin standar obe
obe malah bikin kesenjangan pendidikan makin lebar,"['obe', 'bikin', 'senjang', 'didik', 'lebar']",obe bikin senjang didik lebar
projectproject obe bikin anakanak lebih kreatif,"['projectproject', 'obe', 'bikin', 'anakanak', 'kreatif']",projectproject obe bikin anakanak kreatif
belum semua guru paham cara ngajar pakai obe,"['guru', 'paham', 'ngajar', 'pakai', 'obe']",guru paham ngajar pakai obe
obe membebani guru dengan administrasi yang tidak perlu,"['obe', 'beban', 'guru', 'administrasi']",obe beban guru administrasi
pembelajaran jadi lebih bermakna dengan pendekatan obe,"['ajar', 'makna', 'dekat', 'obe']",ajar makna dekat obe
gontaganti kurikulum malah bikin siswa jadi kelinci percobaan,"['gontaganti', 'kurikulum', 'bikin', 'siswa', 'kelinci', 'coba']",gontaganti kurikulum bikin siswa kelinci coba
menurut saya obe hanya ganti bungkus saja isinya sama,"['obe', 'ganti', 'bungkus', 'isi']",obe ganti bungkus isi
obe bagus untuk pengembangan skill anak di era digital,"['obe', 'bagus', 'kembang', 'skill', 'anak', 'era', 'digital']",obe bagus kembang skill anak era digital
beban kerja guru bertambah dua kali lipat sejak obe,"['beban', 'kerja', 'guru', 'tambah', 'kali', 'lipat', 'obe']",beban kerja guru tambah kali lipat obe
obe bikin anakanak lebih bisa kerja tim,"['obe', 'bikin', 'anakanak', 'kerja', 'tim']",obe bikin anakanak kerja tim
guruguru butuh pelatihan lebih banyak untuk obe,"['guruguru', 'butuh', 'latih', 'obe']",guruguru butuh latih obe
metode obe ngebosenin buat anakanak yang aktif,"['metode', 'obe', 'ngebosenin', 'anakanak', 'aktif']",metode obe ngebosenin anakanak aktif
obe membantu anak memahami tujuan belajar dengan lebih jelas,"['obe', 'bantu', 'anak', 'paham', 'tuju', 'ajar']",obe bantu anak paham tuju ajar
sekolah kami kekurangan sarana untuk nerapin obe dengan baik,"['sekolah', 'kurang', 'sarana', 'nerapin', 'obe']",sekolah kurang sarana nerapin obe
platform digital buat obe sering error jadi tambah ribet,"['platform', 'digital', 'obe', 'error', 'ribet']",platform digital obe error ribet
siswa jadi lebih bersemangat ikut pelajaran sejak pakai obe,"['siswa', 'semangat', 'ajar', 'pakai', 'obe']",siswa semangat ajar pakai obe
bikin pusing saja administrasi obe yang ruwet,"['bikin', 'pusing', 'administrasi', 'obe', 'ruwet']",bikin pusing administrasi obe ruwet
metode penilaian obe lebih adil buat siswa dengan berbagai kemampuan,"['metode', 'nilai', 'obe', 'adil', 'siswa', 'mampu']",metode nilai obe adil siswa mampu
susah nerapin obe kalau jumlah murid di kelas terlalu banyak,"['susah', 'nerapin', 'obe', 'murid', 'kelas']",susah nerapin obe murid kelas
obe ini bagus buat persiapan anak ke dunia kerja masa depan,"['obe', 'bagus', 'siap', 'anak', 'dunia', 'kerja']",obe bagus siap anak dunia kerja
kurikulum obe ngabisin anggaran sekolah buat pelatihan guru,"['kurikulum', 'obe', 'ngabisin', 'anggar', 'sekolah', 'latih', 'guru']",kurikulum obe ngabisin anggar sekolah latih guru
ya gitu obe kadang bagus kadang enggak,"['ya', 'gitu', 'obe', 'kadang', 'bagus', 'kadang']",ya gitu obe kadang bagus kadang
sistem obe membantu anak lebih percaya diri dalam belajar,"['sistem', 'obe', 'bantu', 'anak', 'percaya', 'ajar']",sistem obe bantu anak percaya ajar
budget sekolah habis buat beli perlengkapan obe,"['budget', 'sekolah', 'habis', 'beli', 'lengkap', 'obe']",budget sekolah habis beli lengkap obe
penilaian di obe terlalu subjektif bikin bingung,"['nilai', 'obe', 'subjektif', 'bikin', 'bingung']",nilai obe subjektif bikin bingung
obe membantu siswa memahami relevansi pelajaran dengan kehidupan nyata,"['obe', 'bantu', 'siswa', 'paham', 'relevansi', 'ajar', 'hidup', 'nyata']",obe bantu siswa paham relevansi ajar hidup nyata
terlalu banyak istilah asing di obe bikin guruguru pusing,"['istilah', 'asing', 'obe', 'bikin', 'guruguru', 'pusing']",istilah asing obe bikin guruguru pusing
obe butuh internet yang bagus di desa mana ada,"['obe', 'butuh', 'internet', 'bagus', 'desa']",obe butuh internet bagus desa
perubahan ke obe lumayan lancar di sekolah kami,"['ubah', 'obe', 'lumayan', 'lancar', 'sekolah']",ubah obe lumayan lancar sekolah
guruguru senior kesulitan adaptasi sama obe,"['guruguru', 'senior', 'sulit', 'adaptasi', 'obe']",guruguru senior sulit adaptasi obe
kemampuan public speaking anakanak meningkat dengan obe,"['mampu', 'public', 'speaking', 'anakanak', 'tingkat', 'obe']",mampu public speaking anakanak tingkat obe
terlalu banyak penilaian di obe bikin guru kewalahan,"['nilai', 'obe', 'bikin', 'guru', 'kewalahan']",nilai obe bikin guru kewalahan
anakanak jadi bisa belajar sesuai minat mereka dengan obe,"['anakanak', 'ajar', 'sesuai', 'minat', 'obe']",anakanak ajar sesuai minat obe
obe malah bikin guru fokus ke administrasi daripada ngajar,"['obe', 'bikin', 'guru', 'fokus', 'administrasi', 'ngajar']",obe bikin guru fokus administrasi ngajar
tidak semua siswa cocok dengan metode pembelajaran obe,"['siswa', 'cocok', 'metode', 'ajar', 'obe']",siswa cocok metode ajar obe
keren obe ini anakanak jadi lebih kreatif dan inovatif,"['keren', 'obe', 'anakanak', 'kreatif', 'inovatif']",keren obe anakanak kreatif inovatif
obe tidak realistis diterapkan di sekolah dengan dana terbatas,"['obe', 'realistis', 'terap', 'sekolah', 'dana', 'batas']",obe realistis terap sekolah dana batas
ujungnya nilai anak tetep dilihat dari un jadi obe percuma,"['ujung', 'nilai', 'anak', 'tetep', 'un', 'obe']",ujung nilai anak tetep un obe
obe bikin pembelajaran lebih terintegrasi dengan teknologi,"['obe', 'bikin', 'ajar', 'integrasi', 'teknologi']",obe bikin ajar integrasi teknologi
guru jadi kebingungan cara ngasih nilai di kurikulum obe,"['guru', 'bingung', 'ngasih', 'nilai', 'kurikulum', 'obe']",guru bingung ngasih nilai kurikulum obe
banyak orangtua yang tidak suka sama obe karena beda sama jaman mereka dulu,"['orangtua', 'suka', 'obe', 'beda', 'jaman']",orangtua suka obe beda jaman
obe bagus untuk keterampilan abad 21 yang dibutuhkan anakanak,"['obe', 'bagus', 'terampil', 'abad', '21', 'butuh', 'anakanak']",obe bagus terampil abad 21 butuh anakanak
tidak ada bedanya obe sama kurikulum sebelumnya hanya ganti nama,"['beda', 'obe', 'kurikulum', 'ganti', 'nama']",beda obe kurikulum ganti nama
guruguru jadi tambah stress garagara obe,"['guruguru', 'stress', 'garagara', 'obe']",guruguru stress garagara obe
obe membuat siswa lebih siap menghadapi tantangan masa depan,"['obe', 'siswa', 'hadap', 'tantang']",obe siswa hadap tantang
pelatihan obe tidak jelas guruguru masih bingung,"['latih', 'obe', 'guruguru', 'bingung']",latih obe guruguru bingung
anakanak lebih punya inisiatif belajar dengan sistem obe,"['anakanak', 'inisiatif', 'ajar', 'sistem', 'obe']",anakanak inisiatif ajar sistem obe
kepala sekolah saja tidak ngerti obe gimana ingin nerapin,"['kepala', 'sekolah', 'ngerti', 'obe', 'gimana', 'nerapin']",kepala sekolah ngerti obe gimana nerapin
obe hanya cocok buat sekolah elite di kota besar,"['obe', 'cocok', 'sekolah', 'elite', 'kota']",obe cocok sekolah elite kota
mending fokus benerin gaji guru daripada gantiganti kurikulum terus,"['mending', 'fokus', 'benerin', 'gaji', 'guru', 'gantiganti', 'kurikulum']",mending fokus benerin gaji guru gantiganti kurikulum
obe mendukung pengembangan karakter siswa dengan lebih baik,"['obe', 'dukung', 'kembang', 'karakter', 'siswa']",obe dukung kembang karakter siswa
materi obe terlalu banyak waktu ngajarnya kurang,"['materi', 'obe', 'ngajarnya']",materi obe ngajarnya
sistem obe bikin anakanak lebih siap masuk dunia kerja,"['sistem', 'obe', 'bikin', 'anakanak', 'masuk', 'dunia', 'kerja']",sistem obe bikin anakanak masuk dunia kerja
terlalu banyak rubrik penilaian di obe bikin guru mumet,"['rubrik', 'nilai', 'obe', 'bikin', 'guru', 'mumet']",rubrik nilai obe bikin guru mumet
obe mah hanya program pencitraan saja,"['obe', 'mah', 'program', 'citra']",obe mah program citra
tidak semua mata pelajaran cocok diajarkan pakai metode obe,"['mata', 'ajar', 'cocok', 'ajar', 'pakai', 'metode', 'obe']",mata ajar cocok ajar pakai metode obe
anakanak jadi lebih bisa berfikir kritis dengan obe,"['anakanak', 'berfikir', 'kritis', 'obe']",anakanak berfikir kritis obe
kurikulum obe lebih membebani siswa dengan tugas yang banyak,"['kurikulum', 'obe', 'beban', 'siswa', 'tugas']",kurikulum obe beban siswa tugas
jujur saja belum liat beda signifikan antara obe sama kurikulum lama,"['jujur', 'liat', 'beda', 'signifikan', 'obe', 'kurikulum']",jujur liat beda signifikan obe kurikulum
metode obe membantu siswa mengembangkan kemampuan problem solving,"['metode', 'obe', 'bantu', 'siswa', 'kembang', 'mampu', 'problem', 'solving']",metode obe bantu siswa kembang mampu problem solving
terlalu teoritis obe ini prakteknya susah,"['teoritis', 'obe', 'praktek', 'susah']",teoritis obe praktek susah
obe bikin guru harus kerja lembur tanpa bayaran tambahan,"['obe', 'bikin', 'guru', 'kerja', 'lembur', 'bayar', 'tambah']",obe bikin guru kerja lembur bayar tambah
tidak semua siswa bisa adaptasi sama model pembelajaran obe,"['siswa', 'adaptasi', 'model', 'ajar', 'obe']",siswa adaptasi model ajar obe
obe memberikan pengalaman belajar yang lebih bermakna,"['obe', 'alam', 'ajar', 'makna']",obe alam ajar makna
ribet sekali bikin rpp buat kurikulum obe,"['ribet', 'bikin', 'rpp', 'kurikulum', 'obe']",ribet bikin rpp kurikulum obe
obe bagus untuk mengembangkan kreativitas dan inovasi siswa,"['obe', 'bagus', 'kembang', 'kreativitas', 'inovasi', 'siswa']",obe bagus kembang kreativitas inovasi siswa
kurikulum obe bikin orangtua tidak bisa bantu anak belajar di rumah,"['kurikulum', 'obe', 'bikin', 'orangtua', 'bantu', 'anak', 'ajar', 'rumah']",kurikulum obe bikin orangtua bantu anak ajar rumah
sekolah butuh dana lebih besar untuk nerapin obe dengan baik,"['sekolah', 'butuh', 'dana', 'nerapin', 'obe']",sekolah butuh dana nerapin obe
anakanak lebih terampil berkomunikasi sejak belajar pakai obe,"['anakanak', 'terampil', 'komunikasi', 'ajar', 'pakai', 'obe']",anakanak terampil komunikasi ajar pakai obe
kemendikbud tidak siap dengan infrastruktur untuk obe,"['kemendikbud', 'infrastruktur', 'obe']",kemendikbud infrastruktur obe
tidak semua sekolah siap nerapin obe terutama di daerah terpencil,"['sekolah', 'nerapin', 'obe', 'daerah', 'pencil']",sekolah nerapin obe daerah pencil
obe membantu anak memahami dunia nyata lewat projectproject yang dikerjakan,"['obe', 'bantu', 'anak', 'paham', 'dunia', 'nyata', 'projectproject']",obe bantu anak paham dunia nyata projectproject
terlalu banyak istilah teknis di obe yang bikin bingung guru dan orangtua,"['istilah', 'teknis', 'obe', 'bikin', 'bingung', 'guru', 'orangtua']",istilah teknis obe bikin bingung guru orangtua
kemendikbud tidak mikirin beban guru dengan obe,"['kemendikbud', 'mikirin', 'beban', 'guru', 'obe']",kemendikbud mikirin beban guru obe
obe bikin anakanak lebih berani menyampaikan pendapat,"['obe', 'bikin', 'anakanak', 'berani', 'dapat']",obe bikin anakanak berani dapat
yang penting kualitas gurunya bukan nama kurikulumnya,"['kualitas', 'guru', 'nama', 'kurikulum']",kualitas guru nama kurikulum
anakanak lebih semangat presentasi hasil projectnya di obe,"['anakanak', 'semangat', 'presentasi', 'hasil', 'projectnya', 'obe']",anakanak semangat presentasi hasil projectnya obe
banyak guru yang ngajar asalasalan karena bingung sama obe,"['guru', 'ngajar', 'asalasalan', 'bingung', 'obe']",guru ngajar asalasalan bingung obe
obe bikin tugas guru makin numpuk tanpa solusi,"['obe', 'bikin', 'tugas', 'guru', 'numpuk', 'solusi']",obe bikin tugas guru numpuk solusi
beban administrasi obe ngerampok waktu guru untuk kreatif,"['beban', 'administrasi', 'obe', 'ngerampok', 'guru', 'kreatif']",beban administrasi obe ngerampok guru kreatif
obe mendorong pembelajaran yang lebih kolaboratif antar siswa,"['obe', 'dorong', 'ajar', 'kolaboratif', 'siswa']",obe dorong ajar kolaboratif siswa
terlalu cepat ganti kurikulum belum sempat evaluasi yang lama,"['cepat', 'ganti', 'kurikulum', 'evaluasi']",cepat ganti kurikulum evaluasi
penilaian di obe lebih komprehensif dan adil,"['nilai', 'obe', 'komprehensif', 'adil']",nilai obe komprehensif adil
obe nyusahin guru honorer yang gajinya kecil tapi kerjaan dobel,"['obe', 'nyusahin', 'guru', 'honorer', 'gaji', 'kerja', 'dobel']",obe nyusahin guru honorer gaji kerja dobel
kurikulum obe bikin guru jadi robot administrasi,"['kurikulum', 'obe', 'bikin', 'guru', 'robot', 'administrasi']",kurikulum obe bikin guru robot administrasi
metode obe membantu siswa memahami materi dengan lebih baik,"['metode', 'obe', 'bantu', 'siswa', 'paham', 'materi']",metode obe bantu siswa paham materi
guruguru senior pada ingin pensiun garagara stress dengan obe,"['guruguru', 'senior', 'pensiun', 'garagara', 'stress', 'obe']",guruguru senior pensiun garagara stress obe
obe bikin siswa lebih siap masuk dunia kerja modern,"['obe', 'bikin', 'siswa', 'masuk', 'dunia', 'kerja', 'modern']",obe bikin siswa masuk dunia kerja modern
banyak aturan di obe yang tidak masuk akal buat diterapin,"['atur', 'obe', 'masuk', 'akal', 'diterapin']",atur obe masuk akal diterapin
pemerintah tidak mikirin kesejahteraan guru malah nambahin beban dengan obe,"['perintah', 'mikirin', 'sejahtera', 'guru', 'nambahin', 'beban', 'obe']",perintah mikirin sejahtera guru nambahin beban obe
